European Invasive Bacterial Diseases Surveillance Network (EU-IBD),Faith,,,ECDC,Gov,,,absorbed,1999,2007,http://ecdc.europa.eu/en/healthtopics/vaccine-preventable-diseases/EU_IBD/Pages/index.aspx,,,,European Union,,,,,http://ecdc.europa.eu/en/healthtopics/vaccine-preventable-diseases/EU_IBD/Pages/index.aspx,lab,no,no,yes,no,no,,"N. meningitidies, H. influenzae, S. pneumoniae",,
European Network for Pertussis Surveillance,Faith,*can't find,,European Centre for Disease Prevention and Control (ECDC),Gov,,,nf ,nf ,nf ,http://ecdc.europa.eu/en/aboutus/networks/Pages/networks.aspx,,,,European Union,,,,,,lab,no,,nf,nf,nf,,pertussis,,
"International Surveillance Network for the Enteric Infections Salmonella, Campylobacter and VTEC O157 (Enter-Net)",Olivia W.,done,Karissa,"European Commission funded. hosted at the Health Protection Agency, Centre for Infection, in London, UKHPA became part of Public Health England in 2013",Gov,,1993- 2008,absorbed,1993,2008,http://ecdc.europa.eu/en/activities/surveillance/Documents/0909_Enternet_Summary_of_the_Enternet_network_evaluation_and_assessment.pdf http://www.ncbi.nlm.nih.gov/pmc/articles/PMC2640286/pdf/9716971.pdf,Europe,,,European Union,,network of labs in Europe,lab results/confirmed cases,,http://ecdc.europa.eu/en/activities/surveillance/Documents/0909_Enternet_Summary_of_the_Enternet_network_evaluation_and_assessment.pdf http://www.ncbi.nlm.nih.gov/pmc/articles/PMC2640286/pdf/9716971.pdf,lab,no,no,yes,no,no,no,"salmonellosis, verotoxin producing E. coli (VTEC) and campylobacteriosis.","As of Oct. 2007, Enternet was integrated into the ECDC; data collection has been taken over by The European Surveillance System (TESSy)",
(European Network for Plant Health Information Systems) EUROPHYT: EUROPHYT-CIRCA & EUROPHYT-PHYT,Olivia W.,done,Karissa,European Commission and member states. Launched by DG Health and Consumers Protection.,Gov,,,current,1992,2003,http://ec.europa.eu/food/plant/plant_health_biosecurity/europhyt/network/index_en.htm,European Union,,,European Union,,plant health authorities,data entered by plant health authorities about interceptions they have made,,http://ec.europa.eu/food/plant/plant_health_biosecurity/europhyt/network/index_en.htm,NPHR,no,,no,no,yes,,NA,http://ec.europa.eu/idabc/en/document/2267/16.html#what,
European Antimicrobial Resistance Surveillance Network Surveillance (EARS-Net),Olivia W.,,,European Centre for Disease Prevention and Control (ECDC),Gov,,,Current,2010,C,,,,,European Union,,network of laboratories and hospital,surveys about blood cultures,,,"Other surveillance systems, lab",no,no,yes,no,no,,antibiotic-resistant strains of bacteria,,
European Network for Hepatitis B and C Surveillance,Faith,,,ECDC,Gov,,,absorbed,2006,2011,http://ecdc.europa.eu/en/healthtopics/viral-hepatitis/hepatitis/Pages/european-network-hepatitis.aspx,,,,European Union,,,,,http://ecdc.europa.eu/en/healthtopics/viral-hepatitis/hepatitis/Pages/european-network-hepatitis.aspx,PHOR,no,no,yes,no,no,,Hepatitis B; Hepatitis C,,
Survey of Prevalent HIV Infections Diagnosed (SOPHID),Faith,,,Public Health England,Gov,,,terminated,1995,2014,https://www.gov.uk/government/uploads/system/uploads/attachment_data/file/336380/SOPHID_metadata_v2_v200913__3_.pdf,,,,"England, Wales, Northern Ireland ",,,,,,clinical,no,,yes,no,no,,HIV/AIDS,https://www.gov.uk/hiv-surveillance-systems,
HIV and AIDS New Diagnoses Database (HANDD),Faith,,,Public Health England,Gov,,,terminated,nf ,2015,https://www.gov.uk/government/uploads/system/uploads/attachment_data/file/336382/HANDD_metadata_SC__2_.pdf,,,,"England, Wales, Northern Ireland ",,,,,https://www.gov.uk/government/uploads/system/uploads/attachment_data/file/336382/HANDD_metadata_SC__2_.pdf,"lab, clinical",no,,yes,no,no,,HIV/AIDS,,
Recent Infection Testing Algorithm (RITA),Faith,,,Health Protection Agency (HPA),Gov,,,Current,2009,C,https://www.gov.uk/government/uploads/system/uploads/attachment_data/file/331152/RITA_metadata_v1_24_09_2013.pdf,,,,"England, Wales, Northern Ireland",,,Specimens from individuals newly diagnosed with HIV are sent by laboratories to the Virus Reference Department at PHE Colindale for recent infection testing using the AxSYM avidity assay,,https://www.gov.uk/government/uploads/system/uploads/attachment_data/file/331152/RITA_metadata_v1_24_09_2013.pdf,lab,no,no,yes,no,no,,HIV,,
CD4 Surveillance Scheme,Faith,,,Public Health England,Gov,,,Current,1995,C,https://www.gov.uk/government/uploads/system/uploads/attachment_data/file/331154/CD4_metadata_v2_200913__2_.pdf,,,,"England, Wales, Northern Ireland",,,,,https://www.gov.uk/government/uploads/system/uploads/attachment_data/file/331154/CD4_metadata_v2_200913__2_.pdf,lab,no,,yes,no,no,,HIV/AIDS,,
Public Health Laboratory Service Communicable Disease Surveillance Center (PHLS CDSC),Laura H.,,,Public Health Laboratory Service,Gov,,,absorbed ,1977,1995,http://www.ncbi.nlm.nih.gov/pmc/articles/PMC1342122/pdf/bmjcred00261-0041.pdf,(Scotland Data collected seperately),,,"England, Wales",,labs,lab reports,,http://www.ncbi.nlm.nih.gov/pmc/articles/PMC1342122/pdf/bmjcred00261-0041.pdf,lab,no,,yes,no,no,,nonspecific (communicable diseases),,
Gonococcal Resistance to Antimicrobials Surveillance Programme (GRASP),Faith,,,Public Health England,Gov,,,Terminated,2000,2011,http://webarchive.nationalarchives.gov.uk/20140714084352/http://www.hpa.org.uk/Topics/InfectiousDiseases/InfectionsAZ/Gonorrhoea/AntimicrobialResistance/,,,,"England, Wales",,,,,http://webarchive.nationalarchives.gov.uk/20140714084352/http://www.hpa.org.uk/Topics/InfectiousDiseases/InfectionsAZ/Gonorrhoea/AntimicrobialResistance/,"lab, clinical",no,,yes,no,no,,gonorrhea,,
Genitourinary medicine clinic activity dataset (GUMCADv2),Faith,,,Public Health England,Gov,,,Current,2010,C,https://www.gov.uk/genitourinary-medicine-clinic-activity-dataset-gumcadv2,,,,England,,,,,https://www.gov.uk/genitourinary-medicine-clinic-activity-dataset-gumcadv2,clinical,no,no,yes,no,no,,"Chlamydia, Gonnorrhea, Syphilis, Genital Herpes, HIV, Hepatitis, Genital warts",,
English Surveillance Programme for Antimicrobial Utilization and Resistance (ESPAUR),Faith,,,Public Health England,Gov,,,Terminated,2010,2013,https://www.gov.uk/government/publications/english-surveillance-programme-antimicrobial-utilisation-and-resistance-espaur-report,,,,England,,,,,https://www.gov.uk/government/publications/english-surveillance-programme-antimicrobial-utilisation-and-resistance-espaur-report,"clinical, lab",no,,yes,no,no,,"antimicrobial use, antimicrobial resistance",http://www.ncbi.nlm.nih.gov/pubmed/24027247,
HPA Regional Microbiology Network (RMN),Faith,,,Health Protection Agency (HPA),Gov,not sure - network of labs,,nf ,2006,nf ,https://books.google.com/books?id=wGxyJ11WAR0C&pg=PA121,,,,England,,,,,https://books.google.com/books?id=VW94AgAAQBAJ&pg=PA135,lab,no,,yes,yes,yes,,nonspecific,"clinical, food, water, environemntal samples",
DIVINE-NET,Olivia W.,,ZSG,European Centre for Disease Prevention and Control,Gov,,"June 1, 2004 - December 2007",Terminated,6/1/2004,2004,http://ec.europa.eu/research/health/infectious-diseases/emerging-epidemics/projects/172_en.html,"Denmark, Finland, France, Germany, Hungary, Ireland, Italy, Netherlands, Norway, Slovenia, Spain, Sweden, United Kingdom",,,"Denmark, Finland, France, Germany, Hungary, Ireland, Italy, Netherlands, Norway, Slovenia, Spain, Sweden, United Kingdom",,laboratories,laboratory data,,http://ec.europa.eu/research/health/infectious-diseases/emerging-epidemics/projects/172_en.html,lab,no,,yes,no,no,,"norovirus, foodborne",,
Statens Serum Institut (SSI),Laura H.,,,Danish Ministry of Health,Gov,not a surveillance system,,Current,9/9/1902,C,http://www.ssi.dk/English.aspx,Denmark,,,Denmark,,,,,http://www.ssi.dk/English.aspx,lab,no,,yes,no,no,,nonspecific,,
Boletín Epidemiológico del IPK,Laura H.,,,Departamento de Vigilancia Epidemiológica de la Subdirección de Epidemiología del IPK ,Gov,,2004-current,Current,2004,C,http://boletines.sld.cu/ipk/informacion/,Cuba,,,Cuba,,,,,http://boletines.sld.cu/ipk/informacion/,"other surveillance systems, PHOR",no,no,yes,no,no,Diarrhea,"Diarrhea, Leprosy, Malaria, Measles, Mumps, Rubella, Shigellosis, Tetanus, Typhoid, Hepatitis, Varicella, Chickenpox, Pertussis",,
Canadian Perinatal HIV Surveillance Program,Robyn,done,Robyn,Public Health Agency of Canada,Gov,,-current,Terminated,1979,2012,,Canada,,,Canada,,"HIV Clinics: national, non-nominal confidential survey of infants known to participating pediatricians in tertiary care centers and specialists","laboratory confirmed cases by four months of age (before that ""infection status not confirmed"")",,,clinical,no,no,yes,no,no,,HIV/AIDS,,
Creutzfeldt-Jakob Disease Surveillance System (CJDSS),Laura H.,,,Public Health Agency of Canada,Gov,,1998-current,Current ,1998,2015,http://www.phac-aspc.gc.ca/hcai-iamss/cjd-mcj/cjdss-ssmcj/stats-eng.php,Canada,,,Canada,,,,,http://www.phac-aspc.gc.ca/hcai-iamss/cjd-mcj/cjdss-ssmcj/stats-eng.php,"clinical, lab",no,no,yes,no,no,,Creutzfeldt-Jakob Disease,called 1-888-489-2999 to get more  info,
Canadian Integrated Program for Antimicrobial Resistance Surveillance (CIPARS),Laura H.,,,Public Health Agency of Canada (PHAC),Gov,,1997-2007,Terminated,1997,2007,http://www.phac-aspc.gc.ca/cipars-picra/index-eng.php,Canada,,,Canada,,,,,http://www.phac-aspc.gc.ca/cipars-picra/index-eng.php,lab,no,no,yes,no,yes,,antimicrobial resistance ,,
Canadian Congenital Anomalies Surveillance Network (CCASN),Laura H.,,,Public Health Agency of Canada (PHAC),Gov,,2002-2013,Terminated,2002,2013,http://www.phac-aspc.gc.ca/ccasn-rcsac/index-eng.php,Canada,,,Canada,,,,,http://www.phac-aspc.gc.ca/ccasn-rcsac/index-eng.php,lab,no,,yes,no,no,,chronic,,
Respiratory Virus Detection Surveillance System Canada,Laura H.,,,Public Health Agency of Canada (PHAC),Gov,,2004-current,Current,2004,C,,Canada,,,Canada,,,,,http://www.phac-aspc.gc.ca/bid-bmi/dsd-dsm/rvdi-divr/2014-2015/28/rvdi_divr28-eng.php,lab,no,no,yes,no,no,,"Influenza, RSV, Parainfluenza, Adenovirus, hMPV, Rhinovirus, Coronavirus ",,
Measles and Rubella Surveillance (MARS) pilot,Olivia W.,,,Public Health Agency of Canada,Gov,,June 2011- ?,Current,2011,C,http://www.phac-aspc.gc.ca/surveillance-eng.php,,,,Canada,,laboratories,non-nominal augmented laboratory data,,http://www.phac-aspc.gc.ca/surveillance-eng.php,lab,no,,yes,no,no,,"measles, rubella, mumps",,
National Enteric Surveillance Program (NESP),Laura H.,,,Public Health Agency of Canada (PHAC),Gov,,1997-2012,Terminated,1997,2012,https://www.nml-lnm.gc.ca/NESP-PNSME/index-eng.htm,,,,Canada,,,,,nalysis and reporting of laboratory confirmed enteric disease cases in Canada,lab,no,,yes,no,no,,"Salmonella, Campylobacter, Shigella, Vibrio, Verotoxigenic E. coli, Yersinia; intestinal parasitic organisms such as Giardia, Cryptosporidium, Entamoeba and Cyclospora; and enteric viruses such as Norovirus and Rotavirus.",,
Enhanced National Invasive Pneumococcal Disease Surveillance System pilot,Olivia W.,done,Robyn,"Public Health Agency of Canada, Centre for Immunization and Respiratory Infectious Diseases (CIRID) and the National Microbiology Laboratory (NML).",Gov,,2011-current,current,2011,C,http://www.phac-aspc.gc.ca/surveillance-eng.php#eipd,"One province (expanding to two more soon), Canada",,,Canada,,NF,laboratory and epidemiological data,,http://www.phac-aspc.gc.ca/surveillance-eng.php#eipd,"lab, clinical",no,no,yes,no,no,,invasive pneumococcal disease,,
Canadian Measles/Rubella Surveillance System (CMRSS),Laura H.,,,Public Health Agency of Canada (PHAC),Gov,,2014-current,Current,2014,C,http://www.phac-aspc.gc.ca/mrwr-rhrr/index-eng.php,Canada,,,Canada,,,,,http://www.phac-aspc.gc.ca/mrwr-rhrr/index-eng.php,"lab, clinical",no,no,yes,no,no,,Measles; Rubella,,
FoodNet (Canada),Olivia W.,done,Robyn,Public Health Agency of Canada,Gov,,,Current,2005,C,http://www.phac-aspc.gc.ca/foodnetcanada/overview-apercu-eng.php,,,,Canada,,"sentinel surveillance system (network of public health units, public health and private laboratories, farms, retail food outlets and sources of drinking water) Currently three sites: Ontario (Middlesex-London Health Unit), British Columbia (Fraser Health Authority), and Alberta (Alberta Health Services: Calgary and Central Zones).","microbial subtyping comparison, comparative exposure assessment, outbreak data analysis, case control study, intervention study",,http://www.phac-aspc.gc.ca/foodnetcanada/overview-apercu-eng.php,"lab, clinical, PHOR",no,no,yes,no,no,,food borne diseases,,
National HIV/AIDs Surveillance in Canada,Olivia W.,done,Robyn,Public Health Agency of Canada,Gov,,,Terminated,1979,2012,http://www.phac-aspc.gc.ca/aids-sida/publication/survreport/2012/dec/index-eng.php,Canada,,,Canada,,all provincial and territorial public health authorities,"laboratory confirmed cases (confirmed, repeatedly reactive screening test for HIV antibody)",,,"lab, PHOR",no,no,yes,no,no,,HIV/AIDS,,
HIV/AIDs Surveillance in Canada: Tracks Enhanced System,Olivia W.,done,Robyn,Public Health Agency of Canada: Centre for Communicable Diseases and Infection Control,Gov,,-2012,terminated,2012,2013,,Canada,,,Canada,,provincial and territorial public health authorities,laboratory confirmed cases,,,PHOR,no,,yes,no,no,,HIV/AIDS,,
EpiNorth,Olivia W.,,,European Centre for Disease Prevention and Control (ECDC),Gov,,,Terminated,2000,2012,http://www.epinorth.org/,,,,"Belarus, Denmark, Estonia, Finland, Iceland, Latvia, Lithuania, Norway, Poland, Russia, Sweden, Ukraine",,"official web-pages, EpiNorth network","reports, mass media",,http://www.epinorth.org/,"news, PHOR, other surveillance systems",no,,yes,no,no,,nonspecific,,
European Surveillance Network for Vaccine Preventable Diseases (EUVAC-Net),Olivia W.,done,ZSG,Gov,Gov,,1999-2011,Terminated,1999,2011,http://ecdc.europa.eu/en/activities/surveillance/euvac/Pages/index.aspx AND http://www.escvconferences.eu/Muscat_Meas_Rub_ESCV_14Jan.PDF,"Austria, Belgium, Bulgeria, Croatia, Cyprus, Czech Republic, Denmark, Estonia, Finalnd, France, Germany, Hungary, Iceland, Ireland Italy, Latvia, Lithuania, Luxembourg, Malta, Netherlands, Norway, Poland, Portugal, Romania, Slovakia, Slovenia, Spain, Sweden, Switzerland, Turkey, United Kingdom",,,"Austria, Belgium, Bulgaria, Croatia, Cyprus, Denmark, Estonia, Finland, France, Germany, Greece, Hungary, Iceland, Ireland, Italy, Latvia, Liechtenstein, Lithuania, Luxembourg, Malta, Netherlands, Norway, Poland, Portugal, Romania, Slovakia, Slovenia, Spain, Sweden, United Kingdom",,"Network of national surveillance systems, laboratories","laboratory-confirmed cases, clinical data and epidemiological data",,http://ecdc.europa.eu/en/activities/surveillance/euvac/Pages/index.aspx AND http://www.escvconferences.eu/Muscat_Meas_Rub_ESCV_14Jan.PDF,"clinical, lab",no,no,yes,no,no,,"Measles, mumps, rubella, pertussis, varicella",In 2011 the responsibilities of EUVAC-Net were transferred to the ECDC; they are now carried out by the Vaccine Preventable Diseases (VPD) group.,
"Network for Diagnostics of ""Imported"" Viral Diseases (ENIVD)",Olivia W.,done,Karissa,ENIVD is it's own organization. Funded by ECDC,"NP, Gov",,1995-current,current,1995,C,http://www.enivd.de/,,,,"Austria, Belgium, Bosnia and Herzegovina, Bulgaria, Croatia, Cyprus, Czech Republic, Denmark, Estonia, Finland, France, Republic of Macedonia, Germany, England, Scotland, Wales, Greece, Hungary, Iceland, Ireland, Israel, Italy, Kosovo, Latvia, Lithuania, Luxembourg, Malta, Netherlands, Norway, Poland, Portugal, Romania, Russia, Saudi Arabia, Serbia, Slovakia, Slovenia, Spain, Sweden, Switzerland, Turkey",,a network of labs across Europe,"laboratory data on imported, rare and emerging viruses",,http://www.enivd.de/,lab,no,no,yes,no,no,no,viral diseases,includes viruses. List here http://www.enivd.org/,
Creutzfeldt-Jakob Disease International Surveillance Network (formerly EuroCJD),Laura H.,,,"National CJD Research & Surveillance Unit (NCJDRSU), European Centre for Disease Prevention and Control (ECDC)",Gov,,1993-current,Current,1993,C,http://www.eurocjd.ed.ac.uk/surveillance%20data%201.html,,,,"Australia, Austria, Belgium, Canada, Cyprus, Czech Republic, Denmark, Estonia, Finland, France, Germany, Greece, Hungary, Iceland, Ireland, Israel, Italy, Latvia, Netherlands, Norway, Poland, Portugal, Slovakia, Slovenia, Spain, Sweden, Switzerland, United Kingdom",,,,,,"lab, clinical*",no,no,yes,no,no,,Creutzfeldt-Jakob Disease,,
"National Notifiable Diseases Surveillance System (NNDSS), Australia",Faith,,,Australian Department of Health and Ageing,Gov,,1991-current,Current ,1991,C ,http://www9.health.gov.au/cda/source/cda-index.cfm,,,,Australia,,"treating clinicians, diagnostic laboratories or hospitals","unique record reference number, state or territory identifier, disease code, date of onset, date of notification to the relevant health authority, sex, age, Indigenous status and postcode of residence.",,http://www9.health.gov.au/cda/source/cda-index.cfm,"clinical, lab",no,,yes,no,no,,"Anthrax, Botulism, Chikungunya Fever, Cholera, Dengue, Influenza (all strains, seasonal and pandemic), Leprosy, Campylobacteriosis, Cryptosporidiosis ",,
Australian National Creutzfeldt-Jakob Disease Registry ,Faith,,,University of Melbourne,NP,,,Current,1993,C,http://ancjdr.path.unimelb.edu.au/,,,,Australia,,,,,http://ancjdr.path.unimelb.edu.au/,lab,no,,yes,no,no,,Creutzfeldt-Jakob Disease,http://www.health.gov.au/internet/main/publishing.nsf/Content/cda-surveil-surv_sys.htm,
Australian Gonococcal Surveillance Programme,Faith,,,Australian Department of Health,Gov,,,Terminated,1996,2013,http://www.health.gov.au/internet/main/publishing.nsf/Content/cda-pubs-annlrpt-gonoanrep.htm,,,,Australia,,,,,http://www.health.gov.au/internet/main/publishing.nsf/Content/cda-pubs-annlrpt-gonoanrep.htm,lab,no,,yes,no,no,,Gonococcal,http://www.health.gov.au/internet/main/publishing.nsf/Content/cda-surveil-surv_sys.htm,
VIDRL Measles Surveillance,Laura H.,,,Victorian Infectious Disease Resource Laboratory (VIDRL),NP,,2006-2014,Absorbed,2006,2014,http://www.vidrl.org.au/about/,,,Victoria /,Australia,,,,,,lab,no,no,yes,no,no,,measles,http://www.vidrl.org.au/surveillance/measles/,
VIDRL Norovirus Surveillance,Laura H.,,,Victorian Infectious Disease Resource Laboratory (VIDRL),NP,,2006-2014,Absorbed,2006,2014,http://www.vidrl.org.au/about/,,,Victoria /,Australia,,,,,,lab,no,no,yes,no,no,,Norovirus,,
Surveillance of Newly Acquired Hepatitis C (SNAHC) pilot ,Faith,,,Health Protection Agency,Gov,,,Terminated,2008,2011,,,,,Australia,,,,,,"lab, clinical",no,,yes,no,no,,Hepatitis C,,
"Queensland Health's Epidemiology, Surveillance, and Research Unit",Laura H.,,,Queensland Health,Gov,,,Current,2010,C,,,,Queensland,Australia,,,,,,"lab, clinical,",no,,yes,no,no,,nonspecific,https://www.health.qld.gov.au/ph/cdb/cdsarunit.asp,"Acquired immunodeficiency syndrome (AIDS) (C),  Acute Flaccid Paralysis, Acute rheumatic fever (C), Acute viral hepatitis (P), Adverse event following immunisation (C), Anthrax (T), Arbovirus (mosquito borne) infections (Alphavirus, Bunyavirus, Flavivirus infections (T)), Any other arbovirus infections (NB: dengue, yellow fever, Japanese encephalitis and Murray Valley encephalitis are listed separately), Australian bat lyssavirus infection (T), Australian bat lyssavirus, potential exposure (C) (T), Avian influenza (P) (T), Botulism (T), Brucellosis, Campylobacteriosis, Chancroid, Chikungunya, Chlamydia trachomatis infection, Cholera (T), Cigutera poisoning (C) (T), Creutzfeldt-Jakob disease (P), Cryptosporidiosis, Dengue (P) (T), Diphtheria (P) (T), Donovanosis, Food or water-borne illness in 2 or more cases (C) (T), Food or water-borne illness in food handler(C) (T), Gonococcal infection, Haemolytic uraemic syndrome (HUS) (C) (T), Haemophilus influenzae type b (invasive) disease (P) (T), Hendra virus infection (T), Hepatitis A  (T), Hepatitis B, Hepatitis C, Hepatitis D, Hepatitis E, Hepatitis (other), HIV (human immunodeficiency virus) infection, Influenza, Invasive Group A streptococcal infection, Japanese encephalitis (T), Lead exposure (notifiable) (blood lead level of 10 ug/dL (0.48 μmol/L) or more), Legionellosis (T), Leprosy (Hansen’s disease), Leptospirosis, Listeriosis, Lyssavirus infection (unspecified) (T), Malaria, Measles (P) (T), Melioidosis, Meningococcal disease (invasive) (P) (T), Mumps, Murray Valley encephalitis (T), Non-tuberculous mycobacterial disease, Paratyphoid (T), Pertussis (C), Plague (T), Pneumococcal disease (invasive), Poliomyelitis (T), Psittacosis (ornithosis), Q fever, Rabies (T), Rotavirus infection, Rubella including congenital rubella, Salmonellosis, Severe acute respiratory syndrome (SARS) (P) (T), Shiga toxin and vero toxin producing E.coli infection  VTEC/SLTEC, Shigellosis, Smallpox (P) (T), Syphilis, including congenital syphilis, Tetanus (C), Tuberculosis (P), Tularaemia (T), Typhoid (T), Varicella - zoster virus infection (chickenpox, shingles or unspecified), Viral haemorrhagic fevers (Crimean-Congo, Ebola, Lassa fever and Marburg viruses) (P) (T), Yellow fever (T), Yersiniosis"
OzFoodNet Outbreak Database (OFN),Faith,,,New South Wales Government Health (NSW Health),Gov,,2000-2013,Terminated ,2000,2013,http://www.ozfoodnet.gov.au/,,,,Australia,,,,,http://www.ozfoodnet.gov.au/,"lab, clinical, other surveillance system",no,,yes,no,no,,"Campylobacter
Salmonella
Typhoid
Shigella
Shiga Toxin-producing Eschericia coli
Haemolytic Uraemic Syndrome
Listeria
Hepatitis A",http://www.health.gov.au/internet/main/publishing.nsf/Content/cda-surveil-surv_sys.htm,
Australian HIV Surveillance Report,Faith,,,The Kirby Institute,NP,,,Terminated,2012,2013,,,,,Australia,,,,,,"lab, other surveillance systems",no,no,yes,no,no,,HIV,,
Aboriginal Surveillance Reports,Faith,,,The Kirby Institute,NP,,,Current,2008,C,,,,,Australia,,,,,https://kirby.unsw.edu.au/sites/default/files/hiv/resources/2014ATSIP-ASR.pdf,"lab, other surveillance systems",no,no,yes,no,no,,"HIV, viral hepatitis, chlamydia, Donovanosis, Gonorrhea, HBV, Infectious syphillis",,
SIREVA II,K,,,Pan American Health Organization,Gov,,,current,1993,C,http://www.paho.org/hq/index.php?option=com_content&view=article&id=1077&Itemid=1273&limit=1&limitstart=2&lang=en,,,,"Argentina, Bolivia, Brazil, Chile, Colombia, Costa Rica, Cuba, Ecuador, El Salvador, Honduras, Guatemala, Mexico, Nicaragua, Panama, Paraguay, Peru, Dominican Republic, Trinidad and Tobago, Uruguay, Venezuela",,,,,,lab,no,no,yes,no,no,,"S. pneumoniae, H. influenzae and N. meningitidis",http://www.paho.org/hq/index.php?option=com_content&view=article&id=1077&Itemid=1273&limit=1&limitstart=2&lang=en,
European Centre for the Epidemiological Monitoring of AIDS (EuroHIV),Laura H.,,,European Centre for Disease Prevention and Control (ECDC),Gov,,,Absorbed,1984,2007,http://ecdc.europa.eu/en/healthtopics/aids/hiv-network/Pages/EUROHIV_project.aspx,Europe,,Europe,"Albania, Andorra, Armenia, Austria, Azerbaijan, Belarus, Belgium, Bosnia and Herzegovina, Bulgaria, Croatia, Cyprus, Czech Republic, Denmark, Estonia, Finland, France, Georgia, Germany, Greece, Hungary, Iceland, Ireland, Israel, Italy, Kazakhstan, Kyrgyzstan, Latvia, Lithuania, Luxembourg, Malta, Monaco, Montenegro, Netherlands, Norway, Poland, Portugal, Moldova, Romania, Russia, San Marino, Serbia, Slovakia, Slovenia, Spain, Sweden, Switzerland, Tajikistan, Republic of Macedonia, Turkey, Turkmenistan, Ukraine, England, Scotland, Wales, Northern Ireland, Uzbekistan",,,,,http://ecdc.europa.eu/en/healthtopics/aids/hiv-network/Pages/EUROHIV_project.aspx,other surveillance systems,no,,yes,no,no,,HIV/AIDS,,
EpiSouth Network,Laura H.,,,"European Centre for Disease Protection and Control (ECDC), European Union (EU), Europe aid, European Commission",Gov,,2004-2013,Terminated,2006,2010,http://www.episouthnetwork.org/,,,,"Albania, Algeria, Bosnia and Herzegovina, Bulgaria, Croatia, Cyprus, Egypt, Republic of Macedonia, France, Greece, Israel, Italy, Jordan, Lebanon, Libya, Malta, Montenegro, Morocco, Palestine, Romania, Serbia, Slovenia, Spain, Syria, Tunisia, Turkey",,,,,http://www.episouthnetwork.org/,lab,no,,yes,no,no,,NF,,
EpiSouth Plus,,,,,,,,Terminated,2010,2013,http://www.episouthnetwork.org/,,,,"Albania, Algeria, Bosnia and Herzegovina, Bulgaria, Croatia, Cyprus, Egypt, Republic of Macedonia, France, Greece, Israel, Italy, Jordan, Lebanon, Libya, Malta, Montenegro, Morocco, Palestine, Romania, Serbia, Slovenia, Spain, Syria, Tunisia, Turkey",,,,,http://www.episouthnetwork.org/,lab,no,,yes,no,no,,NF,,
Eastern Mediterranean Region Acute Respiratory Infection Surveillance (EMARIS) Network,Faith,,,Centers for Disease Control and Prevention (CDC),Gov,,,nf ,2008,nf ,http://applications.emro.who.int/docs/IC_Meet_Rep_2014_EN_15284.pdf?ua=1,,,,"Afghanistan, Bahrain, Djibouti, Egypt, Iraq, Iran, Jordan, Kuwait, Lebanon, Libya, Morocco, Oman, Pakistan, Palestine, Qatar, Saudi Arabia, Somalia, Sudan, Syria, Tunisia, United Arab Emirates, Yemen",,,,,,lab,no,no,yes,no,no,,Acute Respiratory Infection,http://www.cdc.gov/flu/international/program/emr.htm,
Measles Nucleotide Surveillance (MeaNS),Laura H.,KEEP,ZG-yes,"Health Protection Angency (HPA), now Public Health England (PHE)",Gov,database for storing measles sequences,,Current,1977,C,http://www.hpa-bioinformatics.org.uk/Measles/Public/Web_Front/main.php,,,,,Global,,,,http://www.hpa-bioinformatics.org.uk/Measles/Public/Web_Front/main.php,"clinical, lab",no,,yes,no,no,,Measles,,
HIV Drug Resistance Database,Olivia W.,done,Robyn,Stanford University,NP,,,current,1998,C,,,,,,global,"academic literature, GenBank","Protease, Reverse Transcriptase or Integrase sequences from virus isolations (80,000+ distinct virus isolations, 40,000 individuals 99% HIV-1 isolates)",,,lab,no,,yes,no,no,,HIV,,
